"Table 379-0030 Gross domestic product (GDP) at basic prices, by North American Industry Classification System (NAICS), provinces and territories, annual (dollars x 1,000,000)(1,2,60,63,64)",,,,,,,
Survey or program details:,,,,,,,
Gross Domestic Product by Industry - Provincial and Territorial (Annual) - 1303,,,,,,,
Geography,Value,North American Industry Classification System (NAICS),2013,2014,2015,2016,2017
Newfoundland and Labrador,Chained (2007) dollars,"Information and communication technology, manufacturing [T014]  (10)",7.9,7.5,6.4,6.6,8.4
Newfoundland and Labrador,Chained (2007) dollars,"Information and communication technology, services [T015]  (11)",659.9,669.7,668.3,671.1,676.1
Newfoundland and Labrador,Chained (2007) dollars,Crop and animal production [11A]  (13),96,61.7,93.5,103.5,88.6
Newfoundland and Labrador,Chained (2007) dollars,Forestry and logging [113],71,74.4,72,68.5,69.7
Newfoundland and Labrador,Chained (2007) dollars,"Fishing, hunting and trapping [114]",237,210.5,203.5,186,154.8
Newfoundland and Labrador,Chained (2007) dollars,Support activities for agriculture and forestry [115],22,20.9,22.8,21.2,20.8
Newfoundland and Labrador,Chained (2007) dollars,Oil and gas extraction [211],5923.3,5534.6,4677.1,5787.4,6076.8
Newfoundland and Labrador,Chained (2007) dollars,Mining and quarrying (except oil and gas) [212],2802.3,2361.2,2810.5,2701.8,2756.6
Newfoundland and Labrador,Chained (2007) dollars,Support activities for mining and oil and gas extraction [213],200.5,205,193.6,205.9,238.3
Newfoundland and Labrador,Chained (2007) dollars,"Electric power generation, transmission and distribution [2211]",528,520.6,560.9,565.5,577
Newfoundland and Labrador,Chained (2007) dollars,"Natural gas distribution, water, sewage and other systems [221A]  (19)",35.7,35.3,35.2,35.4,35.4
Newfoundland and Labrador,Chained (2007) dollars,Residential building construction [23A]  (20),566.7,518.9,464.8,419.8,396.3
Newfoundland and Labrador,Chained (2007) dollars,Non-residential building construction [23B]  (20),407.4,352.8,366.8,228.6,195.8
Newfoundland and Labrador,Chained (2007) dollars,Engineering construction [23C]  (20),1179.2,1496.1,1506.1,1517.3,1680.5
Newfoundland and Labrador,Chained (2007) dollars,Repair construction [23D]  (20),181.5,198.3,178.9,182.7,182.1
Newfoundland and Labrador,Chained (2007) dollars,Other activities of the construction industry [23E]  (20),14.4,15.4,14.6,12.4,12.6
Newfoundland and Labrador,Chained (2007) dollars,Food manufacturing [311],273,271.6,274.1,272.9,267.8
Newfoundland and Labrador,Chained (2007) dollars,Beverage and tobacco product manufacturing [312],97.6,97.8,95.2,95,95.2
Newfoundland and Labrador,Chained (2007) dollars,Textile and textile product mills [31A]  (23),2.5,3,5.1,6.3,7.6
Newfoundland and Labrador,Chained (2007) dollars,Clothing and leather and allied product manufacturing [31B]  (24),16.8,14.5,4.1,5.1,4.4
Newfoundland and Labrador,Chained (2007) dollars,Wood product manufacturing [321],19.3,17.3,16.6,18.6,19.1
Newfoundland and Labrador,Chained (2007) dollars,Paper manufacturing [322],32.7,47.3,44.6,40.3,40.2
Newfoundland and Labrador,Chained (2007) dollars,Printing and related support activities [323],13.3,10.2,10.7,10.6,10.2
Newfoundland and Labrador,Chained (2007) dollars,Petroleum and coal product manufacturing [324],321.6,261.2,289,275.3,336.8
Newfoundland and Labrador,Chained (2007) dollars,Chemical manufacturing [325],9.9,5.8,7.2,8.9,11.7
Newfoundland and Labrador,Chained (2007) dollars,Plastics and rubber products manufacturing [326],14.5,14.6,15.1,8.1,7.4
Newfoundland and Labrador,Chained (2007) dollars,Non-metallic mineral product manufacturing [327],20.1,22.2,31.2,35.6,39.1
Newfoundland and Labrador,Chained (2007) dollars,Primary metal manufacturing [331],0.2,0.1,25.9,47.1,90.3
Newfoundland and Labrador,Chained (2007) dollars,Fabricated metal product manufacturing [332],62.7,86.5,79.3,42.8,14.2
Newfoundland and Labrador,Chained (2007) dollars,Machinery manufacturing [333],18.5,23.2,17.7,15.8,16.3
Newfoundland and Labrador,Chained (2007) dollars,Computer and electronic product manufacturing [334],18,14.5,11.6,9.6,11.2
Newfoundland and Labrador,Chained (2007) dollars,"Electrical equipment, appliance and component manufacturing [335]",3,3,4,3.3,4.5
Newfoundland and Labrador,Chained (2007) dollars,Transportation equipment manufacturing [336],40.8,47.3,39.5,8.9,8.6
Newfoundland and Labrador,Chained (2007) dollars,Furniture and related product manufacturing [337],14.4,12.6,11.9,11.5,9.7
Newfoundland and Labrador,Chained (2007) dollars,Miscellaneous manufacturing [339],12.4,11,10.5,10.3,11.9
Newfoundland and Labrador,Chained (2007) dollars,Farm product wholesaler-distributors [411],0.1,0,0,0,0
Newfoundland and Labrador,Chained (2007) dollars,Petroleum product wholesaler-distributors [412],32,28.7,34.7,32.9,34
Newfoundland and Labrador,Chained (2007) dollars,"Food, beverage and tobacco wholesaler-distributors [413]",101.3,85.1,96,98,97.2
Newfoundland and Labrador,Chained (2007) dollars,Personal and household goods wholesaler-distributors [414],29.1,28.9,29.2,28.8,31.4
Newfoundland and Labrador,Chained (2007) dollars,Motor vehicle and parts wholesaler-distributors [415],35.9,42.9,47.9,45.3,48
Newfoundland and Labrador,Chained (2007) dollars,Building material and supplies wholesaler-distributors [416],179.1,180.4,163.8,152.7,158.1
Newfoundland and Labrador,Chained (2007) dollars,"Machinery, equipment and supplies wholesaler-distributors [417]",278.3,288.7,265.1,199.4,204.2
Newfoundland and Labrador,Chained (2007) dollars,Miscellaneous wholesaler-distributors [418],67.6,72.1,72.9,58.3,62.2
Newfoundland and Labrador,Chained (2007) dollars,"Wholesale electronic markets, and agents and brokers [419]",15,20.2,20,17.2,17.6
Newfoundland and Labrador,Chained (2007) dollars,Motor vehicle and parts dealers [441],240.6,255.2,265.8,267.6,288.5
Newfoundland and Labrador,Chained (2007) dollars,Furniture and home furnishings stores [442],49.8,42,40.3,39.5,37.8
Newfoundland and Labrador,Chained (2007) dollars,Electronics and appliance stores [443],35.5,36,33.8,32.1,30.1
Newfoundland and Labrador,Chained (2007) dollars,Building material and garden equipment and supplies dealers [444],113.4,116.8,111.2,109.5,118.4
Newfoundland and Labrador,Chained (2007) dollars,Food and beverage stores [445],352.8,359.3,362.2,361.2,345.6
Newfoundland and Labrador,Chained (2007) dollars,Health and personal care stores [446],126.1,124.7,132,138.3,141.8
Newfoundland and Labrador,Chained (2007) dollars,Gasoline stations [447],122.3,132,129.1,135.6,134.9
Newfoundland and Labrador,Chained (2007) dollars,Clothing and clothing accessories stores [448],97.1,101.5,103.3,104.6,102.1
Newfoundland and Labrador,Chained (2007) dollars,"Sporting goods, hobby, book and music stores [451]",31.1,31.2,35.5,33.7,31.3
Newfoundland and Labrador,Chained (2007) dollars,General merchandise stores [452],239.7,242.4,242.9,228.6,224
Newfoundland and Labrador,Chained (2007) dollars,Miscellaneous store retailers [453],38.1,43,46.2,49,50.1
Newfoundland and Labrador,Chained (2007) dollars,Non-store retailers [454],37.1,30.2,40.6,45.2,50.3
Newfoundland and Labrador,Chained (2007) dollars,Air transportation [481],80.1,91.1,96.7,106.3,113.2
Newfoundland and Labrador,Chained (2007) dollars,Rail transportation [482],32.5,62.7,70.2,69.4,72.7
Newfoundland and Labrador,Chained (2007) dollars,Water transportation [483],156.7,160.9,163.4,154.5,158.9
Newfoundland and Labrador,Chained (2007) dollars,Truck transportation [484],124.8,137.1,138.6,132.7,139
Newfoundland and Labrador,Chained (2007) dollars,"Transit, ground passenger and scenic and sightseeing transportation [48Z]  (31)",42.5,43.2,42.8,39.2,38.6
Newfoundland and Labrador,Chained (2007) dollars,Support activities for transportation [488],208.5,221.3,227.2,233.7,242.5
Newfoundland and Labrador,Chained (2007) dollars,Pipeline transportation [486],0,0,0,0,0
Newfoundland and Labrador,Chained (2007) dollars,"Postal service, couriers and messengers [49A]  (34)",47.1,47.2,44.8,43.1,42.3
Newfoundland and Labrador,Chained (2007) dollars,Warehousing and storage [493],14.9,16,14.8,16.4,15.1
Newfoundland and Labrador,Chained (2007) dollars,Publishing industries (except internet) [511],50.6,50.1,46.6,44.8,43
Newfoundland and Labrador,Chained (2007) dollars,Motion picture and sound recording industries [512],14.5,15.7,11.9,11.7,11
Newfoundland and Labrador,Chained (2007) dollars,Broadcasting (except internet) [515],38.3,36.2,33.2,34,31.8
Newfoundland and Labrador,Chained (2007) dollars,Telecommunications [517],485.3,500.1,496.6,492.8,488.3
Newfoundland and Labrador,Chained (2007) dollars,"Data processing, hosting, and related services [518]",0.4,0.4,0.3,0.3,0.3
Newfoundland and Labrador,Chained (2007) dollars,Other information services [519],13.9,14.6,15.8,16.5,17
Newfoundland and Labrador,Chained (2007) dollars,Depository credit intermediation and monetary authorities [52B]  (37),452.3,453.8,456.9,468.4,492.9
Newfoundland and Labrador,Chained (2007) dollars,Non-depository credit intermediation [5222],37.9,34.5,33.8,36.5,39
Newfoundland and Labrador,Chained (2007) dollars,Activities related to credit intermediation [5223],30.5,29.5,31,30.9,27.9
Newfoundland and Labrador,Chained (2007) dollars,Insurance carriers and related activities [524],230.9,220.8,228.8,242,224.8
Newfoundland and Labrador,Chained (2007) dollars,"Financial investment services, funds and other financial vehicles [52A]  (39)",99,103.9,113,119,107.1
Newfoundland and Labrador,Chained (2007) dollars,Real estate [531],2070.4,2148.1,2201.8,2233.5,2276.9
Newfoundland and Labrador,Chained (2007) dollars,Rental and leasing services [532],101.1,135.4,134,140,137.9
Newfoundland and Labrador,Chained (2007) dollars,Lessors of non-financial intangible assets (except copyrighted works) [533],11.2,11.1,12.1,12,11.7
Newfoundland and Labrador,Chained (2007) dollars,"Legal, accounting and related services [541A]  (44)",194.3,205.5,234.2,224.1,219
Newfoundland and Labrador,Chained (2007) dollars,"Architectural, engineering and related services [5413]",169.1,187.7,153.8,148.2,140.3
Newfoundland and Labrador,Chained (2007) dollars,"Other professional, scientific and technical services including scientific research and development [541B]  (45)",118.6,129,109.9,103.3,102.8
Newfoundland and Labrador,Chained (2007) dollars,Computer systems design and related services [5415],65.4,60.5,63,72.7,81.4
Newfoundland and Labrador,Chained (2007) dollars,"Advertising, public relations, and related services [5418]",12,12,11.8,9.9,10.3
Newfoundland and Labrador,Chained (2007) dollars,Administrative and support services [561],288.4,294.9,289.2,287.2,271.6
Newfoundland and Labrador,Chained (2007) dollars,Waste management and remediation services [562],33.6,37.2,35,34.4,33.4
Newfoundland and Labrador,Chained (2007) dollars,Universities [6113],415,433.1,441.7,445.2,445.1
Newfoundland and Labrador,Chained (2007) dollars,Educational services (except universities) [611B]  (47),875.6,854.4,845.4,835.9,833
Newfoundland and Labrador,Chained (2007) dollars,Health care [62X]  (49),1693.7,1690.8,1715.2,1728.4,1736.6
Newfoundland and Labrador,Chained (2007) dollars,Social assistance [624],115,113.4,117.2,123.4,128
Newfoundland and Labrador,Chained (2007) dollars,"Performing arts, spectator sports and related industries, and heritage institutions [71A]  (51)",27.9,26.5,26.6,26.2,26.5
Newfoundland and Labrador,Chained (2007) dollars,"Amusement, gambling and recreation industries [713]",32.6,33.2,32.9,38.2,36.6
Newfoundland and Labrador,Chained (2007) dollars,Accommodation services [721],135.4,135.1,134.9,134.9,136.1
Newfoundland and Labrador,Chained (2007) dollars,Food services and drinking places [722],295,311.3,316.4,317,316.3
Newfoundland and Labrador,Chained (2007) dollars,Repair and maintenance [811],175.7,180.2,179.9,179.6,181.4
Newfoundland and Labrador,Chained (2007) dollars,Personal services and private households [81A]  (55),126.8,125.1,126.2,127.5,128.7
Newfoundland and Labrador,Chained (2007) dollars,"Religious, grant-making, civic, and professional and similar organizations [813]",134,134.5,136.5,135.6,132.3
Newfoundland and Labrador,Chained (2007) dollars,Federal government public administration [911],637.3,635.1,645.4,647.5,660.1
Newfoundland and Labrador,Chained (2007) dollars,Provincial and territorial public administration [912],689.3,665.3,650.3,652.3,660.2
Newfoundland and Labrador,Chained (2007) dollars,"Local, municipal, regional and aboriginal public administration [91A]  (59)",354.8,367.9,392.5,420.1,417.9
Prince Edward Island,Chained (2007) dollars,"Information and communication technology, manufacturing [T014]  (10)",3.4,2.8,1.5,1.8,1.6
Prince Edward Island,Chained (2007) dollars,"Information and communication technology, services [T015]  (11)",145.1,151.1,154.3,158,160.1
Prince Edward Island,Chained (2007) dollars,Crop and animal production [11A]  (13),182.5,182.3,180.7,188.8,181.4
Prince Edward Island,Chained (2007) dollars,Forestry and logging [113],5.1,4.8,5.5,6,5.7
Prince Edward Island,Chained (2007) dollars,"Fishing, hunting and trapping [114]",81.1,77.7,83.3,71,73.7
Prince Edward Island,Chained (2007) dollars,Support activities for agriculture and forestry [115],14.4,15.5,16.7,16.1,16
Prince Edward Island,Chained (2007) dollars,Oil and gas extraction [211],0,0,0,0,0
Prince Edward Island,Chained (2007) dollars,Mining and quarrying (except oil and gas) [212],1.4,1.1,1.2,1.4,1.6
Prince Edward Island,Chained (2007) dollars,Support activities for mining and oil and gas extraction [213],0.4,0.6,0.4,0.3,0.6
Prince Edward Island,Chained (2007) dollars,"Electric power generation, transmission and distribution [2211]",72.4,78.7,81.2,82.9,84.4
Prince Edward Island,Chained (2007) dollars,"Natural gas distribution, water, sewage and other systems [221A]  (19)",11.1,10.5,10.5,10.8,11
Prince Edward Island,Chained (2007) dollars,Residential building construction [23A]  (20),94.3,78.3,81.5,83.2,110.4
Prince Edward Island,Chained (2007) dollars,Non-residential building construction [23B]  (20),48.7,45.3,37.5,41.9,46.9
Prince Edward Island,Chained (2007) dollars,Engineering construction [23C]  (20),58.6,26.5,21.9,27.4,29.9
Prince Edward Island,Chained (2007) dollars,Repair construction [23D]  (20),58.3,65.3,68.5,68.6,72
Prince Edward Island,Chained (2007) dollars,Other activities of the construction industry [23E]  (20),2.5,2.7,2.5,2.7,3.3
Prince Edward Island,Chained (2007) dollars,Food manufacturing [311],235.3,280.1,268.4,273.6,290.5
Prince Edward Island,Chained (2007) dollars,Beverage and tobacco product manufacturing [312],1.9,2.2,2.1,2.4,2.6
Prince Edward Island,Chained (2007) dollars,Textile and textile product mills [31A]  (23),0.7,0.6,0.5,1.3,0.9
Prince Edward Island,Chained (2007) dollars,Clothing and leather and allied product manufacturing [31B]  (24),0.7,0.8,1.2,0.7,0.7
Prince Edward Island,Chained (2007) dollars,Wood product manufacturing [321],3.2,2.9,1.9,1.8,1.9
Prince Edward Island,Chained (2007) dollars,Paper manufacturing [322],9.3,10.5,10.8,11.5,12.6
Prince Edward Island,Chained (2007) dollars,Printing and related support activities [323],4.1,4.1,4.5,4.5,4.3
Prince Edward Island,Chained (2007) dollars,Petroleum and coal product manufacturing [324],0.7,0.6,0.5,0.6,0.5
Prince Edward Island,Chained (2007) dollars,Chemical manufacturing [325],52.8,58.7,69.4,68.5,71.2
Prince Edward Island,Chained (2007) dollars,Plastics and rubber products manufacturing [326],0,0,0,0,0
Prince Edward Island,Chained (2007) dollars,Non-metallic mineral product manufacturing [327],10.6,6.9,8.2,9.3,10.8
Prince Edward Island,Chained (2007) dollars,Primary metal manufacturing [331],1.2,0.8,1.1,0.9,0.8
Prince Edward Island,Chained (2007) dollars,Fabricated metal product manufacturing [332],17.7,20.6,21.5,22.8,23.4
Prince Edward Island,Chained (2007) dollars,Machinery manufacturing [333],7.4,12.1,20.6,19.7,21.8
Prince Edward Island,Chained (2007) dollars,Computer and electronic product manufacturing [334],4.1,3.8,2.5,2.6,2.2
Prince Edward Island,Chained (2007) dollars,"Electrical equipment, appliance and component manufacturing [335]",0.6,1,4.8,0.9,1.4
Prince Edward Island,Chained (2007) dollars,Transportation equipment manufacturing [336],66.6,60.1,61.7,70.4,72.8
Prince Edward Island,Chained (2007) dollars,Furniture and related product manufacturing [337],2.9,1.5,1.2,1,1.1
Prince Edward Island,Chained (2007) dollars,Miscellaneous manufacturing [339],3.7,2.9,1.4,1.4,1.5
Prince Edward Island,Chained (2007) dollars,Farm product wholesaler-distributors [411],0.7,0.7,0.6,0.6,0.6
Prince Edward Island,Chained (2007) dollars,Petroleum product wholesaler-distributors [412],0.1,0,0,0,0
Prince Edward Island,Chained (2007) dollars,"Food, beverage and tobacco wholesaler-distributors [413]",38.7,35.9,34.2,35.4,35.8
Prince Edward Island,Chained (2007) dollars,Personal and household goods wholesaler-distributors [414],12.1,10.4,9.8,8.9,7.9
Prince Edward Island,Chained (2007) dollars,Motor vehicle and parts wholesaler-distributors [415],4.3,5.2,5,4.4,4.4
Prince Edward Island,Chained (2007) dollars,Building material and supplies wholesaler-distributors [416],10.3,10.4,10.4,10.8,11.4
Prince Edward Island,Chained (2007) dollars,"Machinery, equipment and supplies wholesaler-distributors [417]",33.5,34,38.4,37.4,43.6
Prince Edward Island,Chained (2007) dollars,Miscellaneous wholesaler-distributors [418],9.8,11.9,13.1,13.2,12
Prince Edward Island,Chained (2007) dollars,"Wholesale electronic markets, and agents and brokers [419]",2,3.3,3.4,3.4,3.5
Prince Edward Island,Chained (2007) dollars,Motor vehicle and parts dealers [441],45.1,44.1,48.6,53.7,58.4
Prince Edward Island,Chained (2007) dollars,Furniture and home furnishings stores [442],6,7,6.9,7.7,8.3
Prince Edward Island,Chained (2007) dollars,Electronics and appliance stores [443],9.5,9.8,9.3,8.8,9.6
Prince Edward Island,Chained (2007) dollars,Building material and garden equipment and supplies dealers [444],30.5,30.8,32.7,33.3,35.2
Prince Edward Island,Chained (2007) dollars,Food and beverage stores [445],88,89.1,86.1,85.3,87.6
Prince Edward Island,Chained (2007) dollars,Health and personal care stores [446],28.2,29,29.2,30.2,31.5
Prince Edward Island,Chained (2007) dollars,Gasoline stations [447],16,15.7,16.1,17.2,17.9
Prince Edward Island,Chained (2007) dollars,Clothing and clothing accessories stores [448],23.2,22.1,21.8,23,24.8
Prince Edward Island,Chained (2007) dollars,"Sporting goods, hobby, book and music stores [451]",11.2,8.9,10.4,10.7,10.5
Prince Edward Island,Chained (2007) dollars,General merchandise stores [452],27.5,28.6,29.7,30.8,32.6
Prince Edward Island,Chained (2007) dollars,Miscellaneous store retailers [453],13.5,14.4,14.1,15.7,15.2
Prince Edward Island,Chained (2007) dollars,Non-store retailers [454],24.9,25.4,29.6,31,34.9
Prince Edward Island,Chained (2007) dollars,Air transportation [481],2.8,3,3.3,3.9,4.2
Prince Edward Island,Chained (2007) dollars,Rail transportation [482],0,0,0,0,0
Prince Edward Island,Chained (2007) dollars,Water transportation [483],8.9,9.5,9.9,10,11.3
Prince Edward Island,Chained (2007) dollars,Truck transportation [484],54.9,60.7,63.3,65.6,69.5
Prince Edward Island,Chained (2007) dollars,"Transit, ground passenger and scenic and sightseeing transportation [48Z]  (31)",4.3,4.1,4.6,4.7,4.8
Prince Edward Island,Chained (2007) dollars,Support activities for transportation [488],19.8,21.3,22.3,23.9,24.1
Prince Edward Island,Chained (2007) dollars,Pipeline transportation [486],0,0,0,0,0
Prince Edward Island,Chained (2007) dollars,"Postal service, couriers and messengers [49A]  (34)",25.2,24.7,23.4,21.6,22.2
Prince Edward Island,Chained (2007) dollars,Warehousing and storage [493],4.2,4.3,4.4,4.9,4.8
Prince Edward Island,Chained (2007) dollars,Publishing industries (except internet) [511],17.8,18.5,17.8,18.2,18
Prince Edward Island,Chained (2007) dollars,Motion picture and sound recording industries [512],2.6,3.1,2.9,2.9,2.9
Prince Edward Island,Chained (2007) dollars,Broadcasting (except internet) [515],9.6,9.4,9.2,9.5,8.8
Prince Edward Island,Chained (2007) dollars,Telecommunications [517],95.8,98.4,98.2,99,100
Prince Edward Island,Chained (2007) dollars,"Data processing, hosting, and related services [518]",0.7,0.7,0.6,0.7,0.6
Prince Edward Island,Chained (2007) dollars,Other information services [519],4.4,3.7,3.7,3.4,3.4
Prince Edward Island,Chained (2007) dollars,Depository credit intermediation and monetary authorities [52B]  (37),126.6,127.1,130.5,134.6,137.4
Prince Edward Island,Chained (2007) dollars,Non-depository credit intermediation [5222],14.4,15.9,17.3,18.8,21.2
Prince Edward Island,Chained (2007) dollars,Activities related to credit intermediation [5223],2,2.1,2.3,2.1,2.4
Prince Edward Island,Chained (2007) dollars,Insurance carriers and related activities [524],67.6,64.5,65.7,67.3,64.7
Prince Edward Island,Chained (2007) dollars,"Financial investment services, funds and other financial vehicles [52A]  (39)",32.3,35.4,36.2,38,39.3
Prince Edward Island,Chained (2007) dollars,Real estate [531],618.6,633,651.5,671.5,690.7
Prince Edward Island,Chained (2007) dollars,Rental and leasing services [532],16.1,15.8,15.8,16.4,17.8
Prince Edward Island,Chained (2007) dollars,Lessors of non-financial intangible assets (except copyrighted works) [533],0,0,0,0,0
Prince Edward Island,Chained (2007) dollars,"Legal, accounting and related services [541A]  (44)",41.4,42.2,45.5,47.5,47.5
Prince Edward Island,Chained (2007) dollars,"Architectural, engineering and related services [5413]",17.5,17.6,20.8,19.6,21.2
Prince Edward Island,Chained (2007) dollars,"Other professional, scientific and technical services including scientific research and development [541B]  (45)",23.4,23,24.9,27.1,27.6
Prince Edward Island,Chained (2007) dollars,Computer systems design and related services [5415],29.8,32,35.3,37.6,38.9
Prince Edward Island,Chained (2007) dollars,"Advertising, public relations, and related services [5418]",1.9,1.6,1.6,1.9,1.9
Prince Edward Island,Chained (2007) dollars,Administrative and support services [561],120.2,119.9,116.8,113.4,110.3
Prince Edward Island,Chained (2007) dollars,Waste management and remediation services [562],11.2,11.7,11.5,11.4,11
Prince Edward Island,Chained (2007) dollars,Universities [6113],111.9,107.7,112.2,117.9,120.9
Prince Edward Island,Chained (2007) dollars,Educational services (except universities) [611B]  (47),222.7,224.6,224.7,223.4,227.3
Prince Edward Island,Chained (2007) dollars,Health care [62X]  (49),364.3,364.6,366.4,374.5,378.1
Prince Edward Island,Chained (2007) dollars,Social assistance [624],55.1,59.5,61.7,64.8,67.2
Prince Edward Island,Chained (2007) dollars,"Performing arts, spectator sports and related industries, and heritage institutions [71A]  (51)",20.1,22.5,23,23.2,23.8
Prince Edward Island,Chained (2007) dollars,"Amusement, gambling and recreation industries [713]",29.8,27.9,30.1,29.5,30
Prince Edward Island,Chained (2007) dollars,Accommodation services [721],48.8,49.7,51.3,53.5,56.3
Prince Edward Island,Chained (2007) dollars,Food services and drinking places [722],90.7,94.1,94.7,96.9,100.3
Prince Edward Island,Chained (2007) dollars,Repair and maintenance [811],37.9,39.5,39.6,41,42.3
Prince Edward Island,Chained (2007) dollars,Personal services and private households [81A]  (55),31.6,31.6,31.7,32.3,33
Prince Edward Island,Chained (2007) dollars,"Religious, grant-making, civic, and professional and similar organizations [813]",33.3,33.2,31.2,32,33.1
Prince Edward Island,Chained (2007) dollars,Federal government public administration [911],326.7,318.9,324.2,334.3,337.7
Prince Edward Island,Chained (2007) dollars,Provincial and territorial public administration [912],224.4,219.3,212.3,215.3,217.6
Prince Edward Island,Chained (2007) dollars,"Local, municipal, regional and aboriginal public administration [91A]  (59)",67,64.2,64.5,66,68.7
Nova Scotia,Chained (2007) dollars,"Information and communication technology, manufacturing [T014]  (10)",30.2,32.9,28.8,29.2,29.6
Nova Scotia,Chained (2007) dollars,"Information and communication technology, services [T015]  (11)",1186.3,1250,1275.3,1305.7,1361.8
Nova Scotia,Chained (2007) dollars,Crop and animal production [11A]  (13),258.7,235.3,253.3,248.9,245.7
Nova Scotia,Chained (2007) dollars,Forestry and logging [113],55.4,63.8,64.7,62.5,59.4
Nova Scotia,Chained (2007) dollars,"Fishing, hunting and trapping [114]",429.6,478.6,458.5,417.3,401.6
Nova Scotia,Chained (2007) dollars,Support activities for agriculture and forestry [115],49.8,47.7,54.5,51.5,51.6
Nova Scotia,Chained (2007) dollars,Oil and gas extraction [211],393.2,736.1,538.8,568.2,278.3
Nova Scotia,Chained (2007) dollars,Mining and quarrying (except oil and gas) [212],78.3,81.4,88.9,80.6,117.1
Nova Scotia,Chained (2007) dollars,Support activities for mining and oil and gas extraction [213],72.9,83.5,70.1,51.8,54.7
Nova Scotia,Chained (2007) dollars,"Electric power generation, transmission and distribution [2211]",518.7,516.7,503.4,494.2,489.8
Nova Scotia,Chained (2007) dollars,"Natural gas distribution, water, sewage and other systems [221A]  (19)",67.9,71.3,71.7,71.6,75
Nova Scotia,Chained (2007) dollars,Residential building construction [23A]  (20),591.2,531.1,556.4,580.2,608.5
Nova Scotia,Chained (2007) dollars,Non-residential building construction [23B]  (20),352.9,312.9,292.6,259.5,238.6
Nova Scotia,Chained (2007) dollars,Engineering construction [23C]  (20),377.5,385.7,461.2,611.6,636.8
Nova Scotia,Chained (2007) dollars,Repair construction [23D]  (20),357.4,360.1,379,381.2,393.2
Nova Scotia,Chained (2007) dollars,Other activities of the construction industry [23E]  (20),29.7,31.5,33.2,35.1,35.6
